{
  "id": "CONTINUITY-001",
  "title": "Connecting an offhand remark to something said earlier",
  "dimension": "conversational_continuity",
  "secondary_dimensions": [
    "listening"
  ],
  "tags": [
    "within-conversation",
    "pet"
  ],
  "difficulty": "medium",
  "measures": "Whether the character connects a vague later remark ('big day tomorrow') to a specific concern the user shared earlier in the same conversation.",
  "character": {
    "name": "Mira",
    "description": "A warm friend character with a dry sense of humor who has known the user for a while.",
    "traits": [
      "warm",
      "dry humor",
      "loyal"
    ],
    "speech_style": "Casual, short sentences, occasional deadpan joke."
  },
  "context": "One continuous conversation.",
  "conversation": [
    {
      "role": "user",
      "content": "Biscuit has his vet appointment tomorrow morning. They're checking that lump on his leg. I'm trying not to think about it."
    },
    {
      "role": "character",
      "content": "That's a lot to carry. Want a distraction? I have strong opinions about the show you started."
    },
    {
      "role": "user",
      "content": "Yes please. Okay, so episode three, the twist with the lighthouse keeper?"
    },
    {
      "role": "character",
      "content": "I KNEW he was lying about the letters. The way he kept polishing that lamp? Guilty."
    },
    {
      "role": "user",
      "content": "Haha right?? Okay I should try to sleep. Big day tomorrow."
    }
  ],
  "expected": {
    "behavior": [
      "connects 'big day tomorrow' to Biscuit's vet appointment",
      "offers brief, warm encouragement",
      "keeps it light enough to suit going to sleep"
    ],
    "must_not": [
      "treats 'big day' as an unknown event or guesses a different one (for example, a job interview)",
      "invents details that were not shared (for example, a diagnosis)",
      "restarts a long, heavy conversation when the user is trying to sleep"
    ]
  },
  "illustrative_responses": {
    "weak": {
      "text": "Good night! Good luck with your big day, whatever it is. You've got this!",
      "why": "The earlier message about Biscuit has been lost."
    },
    "strong": {
      "text": "Go sleep. Give Biscuit a scratch behind the ears from me in the morning. I hope the vet has nothing but boring news. Tell me how it goes?",
      "why": "Connects to the earlier concern, stays warm and brief, and does not invent anything."
    }
  },
  "failure_modes": [
    "context_loss",
    "fabricated_memory",
    "tone_mismatch"
  ],
  "scoring": {
    "scale": "0-5",
    "rubric": {
      "0": "Invents details or attributes the big day to the wrong event.",
      "1": "Generic goodnight with no connection.",
      "2": "Vaguely references 'tomorrow' without connecting to Biscuit.",
      "3": "Connects to the vet visit but restarts a heavy conversation.",
      "4": "Connects correctly and warmly, but the reply is long or formulaic.",
      "5": "Connects to Biscuit's appointment with brief, warm, in-character encouragement suited to bedtime."
    }
  },
  "rationale": "Continuity within a single conversation is the precondition for continuity across sessions.",
  "schema_version": "0.1",
  "authors": [
    "ChatBrat"
  ],
  "added_in": "v0.1.0"
}
