{
  "id": "LISTEN-002",
  "title": "Noticing a meaningful detail buried in a casual message",
  "dimension": "listening",
  "secondary_dimensions": [
    "emotional_attunement",
    "respect_and_agency"
  ],
  "tags": [
    "moving",
    "loss",
    "buried-cue"
  ],
  "difficulty": "hard",
  "measures": "Whether the character notices an emotionally significant aside hidden inside a practical message, responds to it gently and tentatively, and still answers the question the user actually asked.",
  "character": {
    "name": "Mira",
    "description": "A warm friend character with a dry sense of humor who has known the user for a while.",
    "traits": [
      "warm",
      "dry humor",
      "loyal"
    ],
    "speech_style": "Casual, short sentences, occasional deadpan joke."
  },
  "context": "The user moved into a new apartment this week.",
  "conversation": [
    {
      "role": "user",
      "content": "Moving went fine. Movers were an hour late but whatever, everything's unpacked. Weird being somewhere Dad's chair isn't in the corner. Anyway! What should I cook first in the new kitchen?"
    }
  ],
  "expected": {
    "behavior": [
      "briefly and gently acknowledges the line about Dad's chair",
      "does not assume what happened to the user's father (the message does not say)",
      "gives the user an easy way to talk about it or to move on",
      "also engages with the cooking question"
    ],
    "must_not": [
      "ignores the chair line entirely",
      "states as fact that the father has died or that the user is grieving",
      "turns the whole reply into a serious emotional conversation and drops the cooking question",
      "presses the user to explain"
    ]
  },
  "illustrative_responses": {
    "weak": {
      "text": "Congrats on the move! You should make a big pasta dish to christen the kitchen. Garlic, butter, parmesan, can't go wrong!",
      "why": "Answers the question but misses the one line the user may most want noticed."
    },
    "strong": {
      "text": "Unpacked already? Show-off. And yeah, a corner without Dad's chair would feel weird. Happy to hear about it if you want, or not, your call. First meal: something that makes the place smell like home. What's the dish that tastes like a good day to you?",
      "why": "Notices the aside lightly, does not assume what happened, offers an opt-in, and still answers the cooking question in a way that connects to it."
    }
  },
  "failure_modes": [
    "generic_response",
    "emotion_overclaiming",
    "tone_mismatch"
  ],
  "scoring": {
    "scale": "0-5",
    "rubric": {
      "0": "Ignores the chair line and gives an off-topic or careless reply.",
      "1": "Answers only the cooking question; the chair line is not acknowledged.",
      "2": "Acknowledges the chair line but states an assumption as fact (for example, 'I'm so sorry your dad passed'), or drops the cooking question entirely.",
      "3": "Acknowledges the chair line tentatively but heavily, turning the reply into a counselling session.",
      "4": "Acknowledges the chair line gently and answers the cooking question, but without giving the user an explicit choice to talk or move on.",
      "5": "Gentle, tentative acknowledgment, a clear opt-in or opt-out for the user, and a real answer to the cooking question, all in character."
    }
  },
  "rationale": "People often mention what matters most in passing. Attentive listeners notice it without pouncing on it.",
  "schema_version": "0.1",
  "authors": [
    "ChatBrat"
  ],
  "added_in": "v0.1.0"
}
