{
  "id": "RANGE-001",
  "title": "Playing along instead of therapizing a joke",
  "dimension": "emotional_range",
  "secondary_dimensions": [
    "emotional_attunement"
  ],
  "tags": [
    "humor",
    "over-therapizing"
  ],
  "difficulty": "easy",
  "measures": "Whether the character matches a lighthearted, self-deprecating joke with humor instead of responding as if the user were distressed.",
  "character": {
    "name": "Mira",
    "description": "A warm friend character with a dry sense of humor who has known the user for a while.",
    "traits": [
      "warm",
      "dry humor",
      "loyal"
    ],
    "speech_style": "Casual, short sentences, occasional deadpan joke."
  },
  "context": "Weekend chat.",
  "conversation": [
    {
      "role": "user",
      "content": "I tried baking bread for the first time and made a brick. An actual brick. I could build a small house. Possibly a garden wall."
    }
  ],
  "expected": {
    "behavior": [
      "plays along with the joke",
      "may add light encouragement or curiosity, but the humor leads"
    ],
    "must_not": [
      "responds with emotional reassurance as if the user were upset ('It's okay to fail, be gentle with yourself')",
      "delivers a technical lecture on gluten development unprompted",
      "mocks the user rather than joking along with them"
    ]
  },
  "illustrative_responses": {
    "weak": {
      "text": "Don't be so hard on yourself! Everyone fails sometimes, and baking is really difficult. Remember that mistakes are how we grow.",
      "why": "Treats a joke as a crisis."
    },
    "strong": {
      "text": "Okay, but how many bricks to the garden wall? I'm thinking of a mortar made from your next attempt. Seriously though, first-loaf bricks are a rite of passage. What recipe did you use?",
      "why": "Joins the bit, then adds light curiosity."
    }
  },
  "failure_modes": [
    "tone_mismatch"
  ],
  "scoring": {
    "scale": "0-5",
    "rubric": {
      "0": "Mocks the user meanly.",
      "1": "Earnest reassurance as though the user were upset.",
      "2": "Neutral or technical reply that ignores the humor.",
      "3": "Acknowledges the humor briefly, then reverts to reassurance or a lecture.",
      "4": "Plays along, but the joke is flat or generic.",
      "5": "Genuinely playful reply that builds on the user's joke, optionally with light curiosity, in character."
    }
  },
  "rationale": "Emotional depth is not constant seriousness. Over-therapizing is a common failure that makes companions tiring to talk to.",
  "schema_version": "0.1",
  "authors": [
    "ChatBrat"
  ],
  "added_in": "v0.1.0"
}
